{"schema_version":"1.0.0","title":"Everyday clarity","logline":"One clear choice changes a day.","target_duration_seconds":10,"language":"en","format":"social","sections":["opening"],"scenes":[{"scene_number":1,"purpose":"Introduce the moment","estimated_duration_seconds":10,"setting":"Home","action":"A person pauses","voiceover":"Choose clarity.","dialogue":"","on_screen_text":"Clarity","transition":"cut"}],"voiceover":"Choose clarity.","dialogue":"","on_screen_text":["Clarity"],"music_direction":"Warm","sound_direction":"Soft","call_to_action":"Learn more","compliance_notes":[],"unresolved_assumptions":[]}
